,Header,Summary,Detail,Link,Category,CreationDate
10,Police seek hi-tech scanners to check vehicles carrying explosives,"For Karachi, law-enforcers recommend 10 scanners to randomly check movement of armed persons.","KARACHI: In a fresh development, the Sindh police have sought support from the provincial government to acquire modern and high-tech vehicle scanners for exit and entry points of the province and key spots across Karachi to keep a check on suspicious vehicles carrying arms and explosives entering and leaving the city. 
The proposal is also designed to modernise the concept of snap-checking in urban policing that usually cause nuisance to road users, a top official told Dawn on Saturday. 
The plan has been forwarded to the finance department of the province and the law enforcement agency is now waiting for a final nod. 
The proposal was conceived more than a year ago. It came to light again after the recent surge of crimes in Karachi and reports of movement of snatched vehicles by carjackers carrying arms from the city to other parts of the country. 

For Karachi, law-enforcers recommend 10 scanners to randomly check movement of armed persons

“We have sought installation of modern high-tech vehicle scanners on key exit and entry points of the province and there are some six such points,” the top official added. 
“We also want scanners within Karachi. Those scanners are compact and not of those kinds which are installed or put in place on highways. They are moveable, easy to handle and need only a couple of people to operate. These machines are used for scanning moving vehicles without creating a scene on roads. In Karachi we have proposed at least 10 compact and smart scanners which we can use for checking and snap-checking when required or on any intelligence-based report.” 
The Sindh police sources said that the law enforcement agency for a long time was pleading for scanners to be installed at key points mainly on the city’s exit and entrance and for that they had approached the authorities concerned to get a nod for procurement. 
“The issue came under the spotlight again in June 2020 when the Pakistan Stock Exchange came under an armed attack,” said a source sharing background information of the proposal. “The investigation into the incident showed serious loopholes and a lack of capacity of the police in some areas. One of which was free movement of [the militants in] a vehicle carrying arms, ammunition and explosives within the city.” 
The findings, he said, pushed the police authorities to further build their case for installation of the scanners at key points of the city connecting with other cities of the province and Balochistan. 
“Similarly, it is also proposed that some of the areas within the city should also be covered. Snap-checking following any lead or an intelligence report sometimes causes inconvenience and attracts a strong reaction from the public. The technology can help in this regard,” he added. 
The PSX had come under attack in June 2020 when four heavily armed attackers lobbed grenades at its entrance and opened fire on security guards and officials. The miscreants were killed in an exchange of fire that also claimed the lives of a police officer and three security guards. 
The outlawed Balochistan Liberation Army (BLA) had claimed responsibility for the attack. 
“It emerged during the course of the investigation that the armed men had entered the city through regular routes and managed to reach their destination, in the heart of the city, successfully without any trouble. It’s difficult to check every moving vehicle and only technology and modern gadgets can help curtail such crimes and terrorist acts,” said a senior official while confirming the proposal for the procurement of the scanners. 
He said the Sindh police budget had a limited capacity for procurement and the law-enforcement agency had sought support from the provincial government for the high-tech equipment. 
With an increase of over Rs6 billion, the Sindh government in June 2021 allocated Rs119.97bn in the head of law and order in its budget for fiscal year 2021-22 compared to Rs113.87bn allocated in the last fiscal year. 
An amount of Rs3.695bn is allocated for purchase of physical assets for the Sindh police. 
Budget document says, of the amount, Rs2 billion will be for procurement of transport and Rs1.1 billion for arms and ammunition.
Published in Dawn, April 10th, 2022
",https://www.dawn.com/news/1684211/police-seek-hi-tech-scanners-to-check-vehicles-carrying-explosives,karachi,2022-04-10
11,"Six-year-old boy raped, murdered in Steel Town","KARACHI: A minor boy was allegedly raped and murdered on the outskirts of the metropolis on Saturday evening, police...","KARACHI: A minor boy was allegedly raped and murdered on the outskirts of the metropolis on Saturday evening, police and hospital officials said.
They added that the body of a six-year-old boy was found from bushes in Soomar Goth within the remit of the Steel Town police station.
Area SHO Shaur Khan Bangash said that the boy was strangled to death.
He said a neighbour of the victim had been identified as the suspected killer. He managed to escape, but efforts were under way to arrest him, he added.
The body was shifted to the Jinnah Postgraduate Medical Centre (JPMC) for a post-mortem examination and to ascertain whether the child was subjected to a criminal assault.
Dr Summaiya Syed, the additional police surgeon at the health facility, confirmed that the six-year-old was subjected to rape before being murdered. 
“There were multiple abrasions all over the body,” she said, adding that samples collected for DNA matching.
Man shot dead
A young man was shot dead on the outskirts of the city on Saturday.
The SITE-Superhighway Industrial Area police said that Mir Ahmed, 26, was killed by unknown persons at Hingora Goth off Superhighway. 
The police suspected some personal enmity behind the murder.
The body was shifted to the Abbasi Shaheed Hospital for completing medico-legal formalities.
Published in Dawn, April 10th, 2022
",https://www.dawn.com/news/1684210/six-year-old-boy-raped-murdered-in-steel-town,karachi,2022-04-10
12,More than 380 fined Rs2m for ‘profiteering’,KARACHI: As many as 383 profiteers were fined over Rs2 million on Saturday as the city administration intensified ...,"KARACHI: As many as 383 profiteers were fined over Rs2 million on Saturday as the city administration intensified its crackdown on the retailers and vendors for violating the officially fixed prices of essential food items during Ramazan.
Official sources said that district Central administration took action against 56 profiteers and fined them Rs796,000, while 150 were fined Rs392,000 in district East.
They said 16 shopkeepers were fined Rs56,000 in district Malir, 53 were fined Rs560,000 in South, and 42 profiteers were fined Rs120,000 in district Korangi.
The sources said that the a fine of Rs120,000 was imposed on 42 shopkeepers and vendors for selling essential food items at the prices higher than those fixed by the administration. 
They said that 37 profiteers were fined Rs59,000 in district Keamari.
Commissioner Muhammad Iqbal Memon said that coordinated measures were taken to ensure the availability of essential food items such as fruit, vegetables, spices, milk, eggs chicken meat, beef, mutton, dates and flour, at notified prices during Ramazan.
Published in Dawn, April 10th, 2022
",https://www.dawn.com/news/1684209/more-than-380-fined-rs2m-for-profiteering,karachi,2022-04-10
13,Death of teenager sparks violence in Korangi,Family alleges Abdullah was tortured to death by policemen; one of three cops at checkpoint commits suicide...,"KARACHI: Violence erupted in a Korangi locality in the small hours of Saturday morning as enraged people set two motorbikes on fire and attacked a police post in protest over the death of a teenage boy who they said was tortured by policemen deputed at a checkpoint for not carrying documents of the motorbike he was riding.
The violent protest prompted higher authorities to intervene into the matter and order an impartial inquiry to ascertain the allegations about the death of 17-year-old Abdullah.
Korangi SSP Faisal Bashir Memon said that Abdullah recently returned home in Ibrahim Hyderi after spending 40 days with Tableeghi Jamaat.
He left his home on Friday at 3pm and was found unconscious on a street near a mosque in Zaman Town’s Tasawar Mahal checkpoint at about 6pm, he said, adding that two people from the mosque informed the checkpoint in charge about the man lying unconscious. The policemen went there and found a cell phone in his pocket. They rang to his mother, who reached the spot along with her brother Yasir. 

Family alleges Abdullah was tortured to death by policemen; one of three cops at checkpoint commits suicide

They took Abdullah to a nearby hospital in Korangi where doctors asked them to take him to the National Institute of Cardiovascular Diseases. They moved him to the cardio facility, where doctors pronounced him dead on arrival.
The SSP said the family took away the body without completing medico-legal formalities. At around 10.15pm, Yasir, the maternal uncle of the victim, called Madadgar-15 and said Abdullah was ‘tortured to death’ allegedly by the policemen posted at the checkpoint.
He said soon after 100-150 protesters gathered at the Tasawar Mahal Chowki and restored to violence and set two parked motorbikes on fire. 
The SSP said after a considerable time, the police pacified the protesters and convinced the family to take the body to the Jinnah Postgraduate Medical Centre for a post-mortem examination.
He said doctors did not find any apparent injury marks on the body.
However, Dr Summaiya Syed, the additional police surgeon of the hospital, said the cause of death was reserved for histopathological and chemical examiner’s report. 
She said the post-mortem examination was carried out in the presence of relatives and police at 2am on Saturday.
The family alleged that that Abdullah had gone to buy Iftar items on a motorbike. He was stopped by the policemen deputed at the checkpoint. As he did not carry with him the bike’s documents, the policemen allegedly took him inside the kiosk and allegedly tortured him.
The SSP said DIG-East Muqaddus Haider ordered an inquiry to ascertain the veracity of the family’s allegations. 
Policeman commits suicide
Later, a policeman, who was present at the checkpoint and called for initial inquiry, committed suicide by shooting himself to death.
The Sharafi Goth police said that Head Constable Mohammad Sajjad, 38, was posted at the Tasawar Mahal police post along with two other policemen when the incident was reported. 
The Korangi SSP said Sajjad and two other policemen were called on Friday night after the incident. He said he appeared to be an “emotional person” and was in “depression”.
He said apparently he ended his life as he feared that he might be implicated in a murder case.
Published in Dawn, April 10th, 2022
",https://www.dawn.com/news/1684208/death-of-teenager-sparks-violence-in-korangi,karachi,2022-04-10
14,Beggars are the choosers!,There are certain rules to begging that all beggars know and that one should also get to know for one’s own good.,"

Appearances can often be deceptive. Two beggars at work in DHA.—Fahim Siddiqi  / White Star

 
KARACHI: They don’t advertise for your zakat donations on big panaflex pasted on building walls or billboards, but they are also there making their presence felt in a big way. There are certain rules to begging that all beggars know and that one should also get to know for one’s own good. Whenever one is eating anything, one will find a beggar closer than that morsel of food one is about to put into one’s mouth. Then one needs to give him (or her or them) something to let one eat in peace. It happens more during Ramazan as more beggars descend upon the big city from all parts of the country because, well, it is the time to give. And the bigger the city, the more loaded the citizens and thus ... the bigger the charity. 
But zakat isn’t all that is on the minds of the beggars. Upon arrival, they first need to find for themselves a nice spot for business. The good spots are taken usually. And they don’t come free either. And the best spots are in Clifton and Defence. These days you also find beggars squatting by the roadside in quiet neighbourhood streets in DHA. Perhaps they get such spots for free or perhaps they were afraid to be picked up by the anti-beggary police. 
Then begging alone is not good. You need to have a partner. Beggar women must be accompanied with a child, the younger the better. Hearts don’t melt at seeing them alone. In fact they are viewed indecently when without little children, unless that is the intention. 

New beggars decsend on all areas particularly DHA, Clifton; menace of beggary thrives as the needy and  greedy get muddled up

“My mother is sick, I need to get her medicine, I need to get her food,” begged a young man at Schon Circle in Clifton. When asked to move out of the way, he explained that he was not a beggar he was selling attar, a little bottle of which he brought out of cloth bag that he was carrying. Then why didn’t he say so in the first place instead of talking about his sick mother? Do the attar sellers in the nice big shops in Saddar also make sales starting like this? 
The man selling shalwar and pajama drawstrings, or izarbund, also had a similar sob story to tell, which people didn’t seem too impressed by. That little four- or five-year-old unwashed child next to him was also not gathering much attention near the Ashiana Shopping Mall. 
But that abaya-clad mother with pleading eyes who was with a four-year-old boy and a six-year-old girl sitting on a sidewalk as one entered Zamazama from Do Talwar made one want to turn around to look at them even after passing them by. The little girl was also holding up a placard with all their hardships listed on it. One wondered where the man in the family was only to read soon enough that he was sick and bedridden. 
A little ahead, another mother with a young child by her side and a wailing baby in her arms said that her husband was dead. Two days later the same women could be found at the same spots but somehow the children with them were different although they were of the same size. 
More women and children were found sitting in lines outside small eateries in DHA’s commercial areas, especially the Phase II Commercial Area off Korangi Road where the people who came to eat themselves were paying for their meals. On average every other customer is seen paying for the meals of five or 10 persons. 
Many homes, especially in DHA are marked by the needy (read greedy) for free giveaways, even by those who are new or just visiting here. Some gather outside their gates soon around Iftar time for free food and whatever else that is on offer for free. The gifts become bigger and better as the month moves ahead. Close to Eid the freebies include new clothes and footwear, too. “Yes beggary is a menace, but during Ramazan, we are also looking to help the needy, so they are welcome to come here. We don’t send away anyone empty-handed,” said one person distributing food and gifts to the ‘poor’ gathered outside his home.
Published in Dawn, April 10th, 2022
",https://www.dawn.com/news/1684207/beggars-are-the-choosers,karachi,2022-04-10
