,Header,Summary,Detail,Link,Category,Pic_url
0,New members of PMDC notified,Health ministry spokesperson says appointments made on merit,"The new members of the Pakistan Medical and Dental Council (PMDC) were notified by the ministry of health services, regulations and coordination on Tuesday.
They were notified “in exercise of the powers conferred by Section-3 of the Pakistan Medical and Dental Council Act, 2022, on the recommendations of the Search and Nomination Committee, and with the approval of the prime minister.”
They have been appointed for a period of four years in terms of Section-7 (1) of PM&DC Act, 2022.
The new members include medical practitioners Prof Amjad Siraj Memon, Prof Rizwan Taj, Muhammad Zubair Khan, Dr Mahmud Aurangzeb and dentist Prof Dr Tehmina Asad.
Dr Tehmina belongs to Pishin, Balochistan and is the first female doctor to be appointed to the council from the province.
Jawad Amin Khan has been appointed as the council's philanthropist, Chaudhry Sultan Mansoor as its lawyer, and Noorul Haque as its chartered accountant.
The ministry’s spokesperson said the appointments were made on merit, with over 70 candidates participating in the interviews.
He added that the head of the search and nomination committee was Federal Health Minister Abdul Qadir Patel.
Quoting Patel, the spokesperson said there would be improvement in the field of medical education with the new PMDC members notified.
The federal minister further said all issues related to medical education should be resolved on a priority basis.
Patel added that the process of reforms in the health sector was under way at a rapid pace.
Also read: Change is in the air at restored PMDC
In January this year, President Dr Arif Alvi had given his assent to the PMDC Bill 2022 after its passage by parliament.
The president signed the bill exercising his powers under Article 75 of the Constitution, a Presidency statement said.
In October 2022, the Senate passed the PMDC (Amendment) Bill but after inserting dozens of amendments into it already passed by the National Assembly.
The bill was moved by PPP legislator Jam Abdul Karim.
Earlier, during the long debate on the bill, opposition members alleged that the legislation was meant to create a lot of incompetent medical professionals and serve the vested interests of a mafia.
Leader of Opposition Dr Shahzad Waseem of PTI objected to the “long list"" of new amendments, suggesting the bill should be sent to the committee again.
However, the treasury benches stressed upon the urgency to have the bill passed saying it was about the future of medical students.
",https://tribune.com.pk/story/2411407/new-members-of-pmdc-notified,national,https://i.tribune.com.pk/media/images/946848-PMDC-1440823075/946848-PMDC-1440823075.jpg
1,Justice Isa faces backlash for attending parliament,PTI leader Fawad calls for his resignation; Gujranwala Bar files complaint with SJC demanding his ouster from post,"Justice Qazi Faez Isa is facing criticism from various quarters for his extraordinary move to attend parliament on the golden jubilee of the 1973 Constitution, but the senior judge justified his action by saying that the event was held to commemorate an important day in the country’s history.
PTI senior leader Fawad Chaudhry accused Justice Isa of showing partiality while paying a visit to parliament and sitting among politicians.
Talking to the media at the Lahore High Court, he demanded that Justice Isa should resign.
He continued that parliament had made a mockery of the top court and Prime Minister Shehbaz Sharif’s resignation was the only solution to all the crises being faced by the country.
Also read: Justice Isa issues clarification on attending NA moot
He pointed out that PM Shehbaz claimed that his government had faced gigantic problems during this year.
Fawad added the premier should not tweet this as the government had passed this year not only violating the Constitution, but also human rights.
He also agreed with “table talks”, saying without negotiations, no political party could move ahead.
Besides the PTI leader, the Gujranwala District Bar also lashed out at Justice Isa for attending parliament and filed a complaint against him in the Supreme Judicial Council (SJC), seeking the judge’s removal from his post.
In its complaint, the Gujranwala Bar accused Justice Isa of “misconduct” and argued that the judge had violated the code of conduct by sitting among “corrupt” politicians.
It added that the Constitution called for a distinction between the judiciary and executive.
In his defence, Justice Isa issued a clarification, which read: “All the Judges of the Supreme Court were invited to celebrate the Golden Jubilee of the Constitution of the Islamic Republic of Pakistan.”
He added that prior to accepting the invitation, inquiries were made as to whether there would be political speeches, and assurances were extended that only the Constitution and its making would be spoken about.
“The programme sent to me also confirmed this. Having cleared this point, first by my staff from the Deputy Director of the National Assembly, and then by me directly with the Speaker, I accepted the invitation as I wanted to show solidarity with the Constitution,” he continued.
The judge maintained that he had been asked if he would like to speak and he had declined. “However, when political statements were made (in a few of the speeches), I requested to speak to correct any misconceptions that may arise, and I did so,” he claimed.
Justice Isa expressed his surprise over some people objecting to where he sat as well as his presence at the function to commemorate the Constitution.
“I would have preferred to sit in the hall on one side or in the gallery, but respect was shown to a member of the judiciary by seating me at the centre; I did not choose to sit there,” he clarified.
The judge pointed out that the Constitution was unanimously enacted by the peoples’ directly elected representatives at all ends political spectrum and that testified to their sagacity.
“It affirmed the Founder’s motto of achieving success; Unity, Faith and Discipline. It established that even the most intractable problems can be solved with sincerity and motivation when the peoples’ interest is kept paramount. I may add that the elected representatives of the people are deserving of all respect. Without the politicians of the All India Muslim League, we would not have gained independence,” he wrote.
He noted that the organisers of the Convention had invited “all to commemorate a singularly important day in Pakistan’s history”.
“The Golden Jubilee of the Constitution is a celebration of all citizens; it is not the exclusive domain of any particular political party or institution. The significance of the Constitution must be impressed upon all, and this should be done continuously,” he added.
Also read: SC stands with Constitution: Justice Isa
The senior judge recalled that when Pakistan did not have a constitution enacted by the directly elected representatives of the people, the country broke apart.
“The lingering mistake was finally rectified 50 years ago and the peoples’ fundamental rights were recognised and enshrined in the Constitution. The salvation of all Pakistanis lies in adherence to the Constitution,” he highlighted.
Justice Isa further wrote that citizens were best served if seeds of discord were not planted.
“The making of the Constitution is one of the greatest moments in our history, which should be celebrated,” he concluded.
",https://tribune.com.pk/story/2411383/justice-isa-faces-backlash-for-attending-parliament,national,https://i.tribune.com.pk/media/images/Qazi-Faez-Isa1681229644-0/Qazi-Faez-Isa1681229644-0.png
2,Maryam to leave for S Arabia today to perform Umrah,Other members of Nawaz Sharif's family also expected to join the PML-N leader,"Pakistan Muslim League-Nawaz Senior Vice President and Chief Organiser Maryam Nawaz will leave for Saudi Arabia on Tuesday (today) to perform Umrah.
According to her family members, Maryam will leave for Jeddah from Lahore’s Allama Iqbal international Airport at 2:30pm by Saudi Airlines flight No SV-739.
She will be accompanied by her husband Captain (retd) Muhammad Safdar, son Junaid Safdar, daughter-in-law Ayesha Saif, two daughters – Mehrun Nisa and Mahnoor Safdar, as well as some employees.
The family members said that former prime minister Nawaz Sharif would also arrive in Saudi Arabia on Tuesday from London.
Maryam and Nawaz will be special guests of the royal family in Saudi Arabia where they will also hold meetings with the Saudi royal leadership.
Nawaz and Maryam will spend the last 10 days of Ramazan in Makkah and Madina.
The PML-N chief organiser will return home on April 26 after performing Umrah.
",https://tribune.com.pk/story/2411341/maryam-to-leave-for-s-arabia-today-to-perform-umrah,national,https://i.tribune.com.pk/media/images/Maryam11659249737-0/Maryam11659249737-0.jpg
3,ECP sees over 120m registered voters in country,Reports figure increased by 14m in five years since 2018 general elections,"With the 2023 general elections just around the corner, the Election Commission of Pakistan on Monday issued a report, stating that the number of registered voters in the country had exceeded 120 million – an increase of over 14 million in the last five years.
During the previous 2018 general elections when the Pakistan Tehreek-e-Insaf came to power, the number of registered voters was 106 million.
The ECP released the number of total registered voters till March 28, 2023, according to which, the total number of voters across Pakistan has exceeded 120.56 million.

The ECP also released the percentage of voters in terms of age. The highest number of voters are in the age group of 26 to 35 years, which make up 26 per cent of the total number of voters.
According to the report, the ratio of male voters in Pakistan is 54 per cent while that of female voters is 46 per cent.
The total number of registered voters in Islamabad is over one million while Punjab tops the list with 71.5 million voters.
Islamabad
The number of registered voters in the federal capital is over one million, of which 536,200 are male voters and 484,753 female.
Balochistan
The number of registered voters in Balochistan is 5.2 million of which 2.9 million are males and 2.2 million are females.
Khyber-Pakhtunkhwa
The number of registered voters in K-P is 20.1 million of which 10.16 million are male voters while 9.72 million are females.
Punjab
In Punjab, the largest province of the country population-wise, the number of registered voters is 71.5 million, of which 38.4 million are men and 33.1 million women.
Sindh
Similarly, the number of registered voters in Sindh is 20.63 million, of which 10.43 million are males while 10.2 million are females.
",https://tribune.com.pk/story/2411338/ecp-sees-over-120m-registered-voters-in-country,national,https://i.tribune.com.pk/media/images/1133654-byelectionsvotingvotepollsPHOTOMohammadNoman-1467315082/1133654-byelectionsvotingvotepollsPHOTOMohammadNoman-1467315082.jpg
4,PM touts ‘reconciliation’ as hallmark of PDM govt,Shehbaz says coalition govt’s one year marks success story of overcoming tough challenges,"Prime Minister Shehbaz Sharif on Tuesday hailed the policy of “reconciliation and cooperation” instead of “confrontation and vendetta” during his first year in office, claiming that the government “largely succeeded” in its endeavours.
In a series of tweets marking one year since he took oath as the prime minister following the exit of Imran Khan from office through a no-confidence motion in April last year, Shehbaz reflected on the developments and achievements of his government.
“Today marks the completion of one year since I took oath as the PM of a coalition government. This has been a time of massive challenges and difficulties. It was a long journey, but sustained efforts made it possible,” he said in one of his tweets.
“I can inform people that over the last one year, we have largely succeeded in establishing Pakistan’s credibility as a partner and friend,” he tweeted. “All predictions of default turned out to be false alarms. Sincere efforts are under way to revive the economy,” he added.
On April 11 last year, Shehbaz took oath of office after the Pakistan Tehreek-e-Insaf (PTI) government was voted out by the National Assembly through a no-confidence motion brought by the Pakistan Democratic Movement (PDM) in the wee hours of April 10.
Shehbaz recalled that the passage of no-confidence vote against Imran-led government was unprecedented, as it brought political forces together “to use the forum of parliament to vote out an unpopular govt” through constitutional means.
He hailed the convergence of political parties with different manifestos on a common national cause represented a “major step forward” in the country’s political evolution. “Reconciliation and cooperation instead of confrontation and vendetta marked the new politics post-April ’22.”
He said despite the economic landmines laid by Imran and the disruptions in global fuel and food supply lines, Pakistan’s economy continued to stay afloat. The government, he added, painstakingly, repaired, rebuilt and deepened Pakistan’s diplomatic relations that were dealt a severe blow by the “Niazi regime”.
He also highlighted the government’s rescue, relief, and rehabilitation efforts following the unprecedented floods in the country last year.
In the last one year, he said, the coalition government made efforts to diversify the energy mix with an aim to provide relief to the citizens.
Shehbaz pointed out that geo-strategic rivalries, increase in fuel and food prices, as well as historic floods were some of the key factors responsible for inflation.
“Mindful of its impact, the government has expanded social safety net and provided targeted subsidies,” he continued.
Under the watch of the PDM government, Pakistan managed to exit the Financial Action Task Force’s grey list, thanks to the excellent inter-ministerial coordination as well as support extended by the military leadership, the prime minister mentioned.
(WITH INPUT FROM APP)
",https://tribune.com.pk/story/2411350/pm-touts-reconciliation-as-hallmark-of-pdm-govt,national,https://i.tribune.com.pk/media/images/WhatsApp-Image-2023-04-03-at-17-06-05-1-696x4641680529249-1/WhatsApp-Image-2023-04-03-at-17-06-05-1-696x4641680529249-1.jpeg
5,Elahi pledges support to CJ to uphold Constitution,Vows not to let Nawaz’s desire of ‘humiliating judiciary’ succeed,"PTI Central President Chaudhry Pervaiz Elahi has lashed out at the prime minister, saying Shehbaz Sharif has followed the path of open rebellion against the Constitution.
The government on Monday had the Supreme Court (Practice and Procedure) Bill, 2023 – which aims to curtail the powers of the chief justice of Pakistan to take suo motu notice and constitute benches on his own – passed by the joint sitting of parliament. The bill had been returned by President Arif Alvi to parliament for reconsideration.
During a meeting with senior Punjab bureaucrats, including Chaudhry Zulfiqar Ghuman, Chaudhry Waseem Ramey, Abdullah Yusuf Waraich, and others, on Monday, Elahi said: “Shehbaz Sharif is being given direct instructions by the government's ‘godfather’ (Nawaz Sharif) from London.”
The PTI central president, “Parliament cannot refuse to provide funds to the Election Commission of Pakistan [for holding elections].
“Anyone who refuses will be held in contempt of court.”
In the judicial wrangling among the Supreme Court judges, Elahi said, “The entire nation stands with Chief Justice (Umar Ata Bandial) to uphold the supremacy of the Constitution.”
Elahi vowed not to let Nawaz’s desire of “humiliating the judiciary” succeed.
On the one hand, he said, the 50th anniversary of the Constitution was being celebrated while on the other, the same Constitution was being flouted
Read Shujaat suspends Elahi from party over merger move
Elahi urged the Pakistan Peoples Party not be involved in the conspiracy to break the Constitution, “if it claims to have made the Constitution”.
In the form of Shehbaz, he said, the nation had been humiliated for a year.
“The lesson of the last year is that Shahbaz Sharif and Pakistan cannot go together anymore. Shahbaz Sharif's one-year government has shaken the hearth of the country.”
He said those who had brought Shahbaz a year ago were now “regretting it”.
“The wheel of the economy has been completely jammed and the credibility of the current government in international financial institutions has become zero.
“In a year, one million youth have left the country because of disappointment while people are dying in queues for free wheat flour.
“The imported government has given the people nothing but inflation, chaos, anarchy, destruction, ruin, despair and hopelessness.”
",https://tribune.com.pk/story/2411332/elahi-pledges-support-to-cj-to-uphold-constitution,national,https://i.tribune.com.pk/media/images/Chaudhry-pervaiz-elahi1671812890-0/Chaudhry-pervaiz-elahi1671812890-0.jpg
6,Clips show Maryam getting caught off guard,Censored parts from a TV interview take social media by storm,"A couple of unaired video clips of Maryam Nawaz’s recent interview with a local TV channel show the Pakistan Muslim League-Nawaz (PML-N) chief organiser getting caught off guard when asked about her assets and Toshakhana gifts.
The video clips of the ruling party leader’s interview with anchorperson Mansoor Ali Khan were not aired but they were leaked to social media on Tuesday.
In these clips, one can see Maryam left baffled when confronted with tough questions about her father, former premier Nawaz Sharif, retaining a high-end Mercedes car from Toshakahan as prime minister during the 1990s.
Maryam initially expressed ignorance about the vehicle but when the interviewer supported his claims by documents, the PML-N leader asked him to stop recording and not to air that part of the interview.
In the censored video clip, the interviewer said Nawaz acquired a vehicle, received as a gift from a Saudi prince, from Toshakhana in violation of the Toshakhana rules.
In response to this, Maryam said that retaining a gift from Toshakhana after paying an amount as per the policy of the depository was not illegal. 
However, the anchor rebutted her claims, saying according to the rules it was not allowed to buy expensive cars from the gift repository.
In the other video, the anchorperson questioned Maryam about her alleged BMW car “which was gifted to her by the UAE’s royal family and the value of the car was declared 3.5 million in the tax year 2009-10”.
However, the PML-N leader responded saying she did not know about this and “will get back to you on this.”
",https://tribune.com.pk/story/2411373/clips-show-maryam-getting-caught-off-guard,national,https://i.tribune.com.pk/media/images/Maryam-Nawaz1681224031-0/Maryam-Nawaz1681224031-0.png
7,Thar Coal is future of Pakistan: Dastagir,"2,640MW electricity was being produced from Thar Coal power plants; held PTI govt responsible for delay in projects","Minister for Power Division Khurram Dastagir Khan on Monday said that Thar Coal was the future of Pakistan and could fulfill the electricity demand of the country.
He was winding up discussion on a motion moved by Senator Taj Haider to discuss the failure to tap into true potential of Thar Coal, pertaining to inordinate delay in construction of second transmission line and Islamkot-Chor Railway line that had left the national grid deprived of affordable electricity.
Sharing the details of Thar Coal project, the minister said that former premier Nawaz Sharif along with ex-president Asif Zardari had laid down the foundation of Thar Coal project in 2014 and extended it by establishing four more plants in 2015 and 2016.
He said that 2,640MW electricity was being produced from Thar Coal power plants and held PTI government responsible for delay in completion of these projects, saying the former ruling party had an anti-development agenda.
",https://tribune.com.pk/story/2411336/thar-coal-is-future-of-pakistan-dastagir,national,https://i.tribune.com.pk/media/images/1208723-KhurramDastagirPID-1477396131/1208723-KhurramDastagirPID-1477396131.jpg
