,Header,Summary,Detail,Link,Category,Pic_url
8,NA observes Golden Jubilee of 1973 Constitution,Passes resolution paying tribute to the framers,"The National Assembly on Monday observed the Golden Jubilee Convention of the 1973 Constitution, paying homage to the members of the Constitution Committee of that year and the fifth lower house of parliament.
Drafted by the government of Zulfikar Ali Bhutto, with additional assistance from the country's opposition parties, the Constitution was unanimously approved by the fifth parliament on April 10 and ratified on August 14, 1973.
A resolution was presented by Senator Raza Rabbani and unanimously adopted by the convention held at the National Assembly Hall.
The resolution said the framers of the Constitution of Pakistan, under the leadership of the then president of the Constituent Assembly, Bhutto, with the meaningful participation of all political leaders, worked tirelessly to ensure that the Constitution represented the aspirations of the people of Pakistan.
It said the 25 members of the Constitution Committee along with all members of the fifth National Assembly who debated, discussed, and voted in favour of the Constitution were worthy of admiration, respect, and gratitude for their contributions to Pakistan's constitutional history, which laid the foundation for its progress and prosperity.
“The Golden Jubilee of the Constitution of the Islamic Republic of Pakistan is an occasion to pay tribute to the framers of the Constitution and to reaffirm our commitment to upholding the principles and values enshrined in the Constitution.
“The Golden Jubilee Celebration Year of the Constitution of the Islamic Republic of Pakistan is also an occasion to express denunciation of all those who abrogated, subverted, and suspended the Constitution and/or upheld or otherwise lent legitimacy to it; and to reaffirm our commitment to protect the Constitution from any adventurism.”
The resolution said the Constitution of Pakistan was the supreme law of the land, and it defined the basic structure, functions, and powers of the state and its institutions.
Read Justice Isa addresses NA convention, says SC stands with Constitution
The Constitution of Pakistan adopted in 1973 was drafted by a committee of 25 members under the chairmanship of Honorable Abdul Hafeez Pirzada, who worked tirelessly and with great dedication to ensure that the Constitution reflected the aspirations and ideals of the people of Pakistan.
The Constitution Committee of 1973 included distinguished jurists, scholars, and political leaders, who sacrificed their time, energy, and resources in a selfless manner for the betterment of Pakistan.
The resolution expressed resolve that parliament commemorated the Golden Jubilee of the Constitution of the Islamic Republic of Pakistan, 1973 and paid homage to the framers of the Constitution - who came from all walks of life representing all provinces, socio-culture, and religious segments - for their vision, dedication, and commitment to the people of Pakistan. It reaffirmed its commitment to upholding the Constitution and the rule of law, and to ensuring that the Constitution remained a living document that reflected the aspirations and needs of the people of Pakistan.
The resolution saluted the members of the Constitution Committee of 1973 and National Assembly of the Islamic Republic of Pakistan for their dedication, commitment, and vision in drafting the Constitution of Pakistan, which remained a beacon of hope and inspiration for the people of Pakistan.
The resolution expressed denunciation of all those who abrogated, subverted, and suspended the Constitution and/or upheld or otherwise lent legitimacy to it.
It acknowledged and appreciated the hard work and sacrifices made by the members of the Constitution Committee of 1973 and the fifth National Assembly and recognised their invaluable contribution to Pakistan's constitutional heritage.
The resolution expressed its gratitude and deep appreciation for the outstanding leadership of the then President of the Constituent Assembly, Zulfiqar Ali Bhutto, Speaker Honorable Fazal Elahi Chaudhry as well as the Honorable Abdul Hafeez Pirzada who chaired the Constitution Committee of 1973 with great wisdom, integrity, and impartiality.
The resolution also recalled with gratitude the historic contributions in the service of the people and the country by stalwarts like the then Leader of the Opposition Khan Abdul Wali Khan, Maulana Mufti Mehmood, Maulana Shah Ahmed Noorani, Mir Ghaus Bakhsh Bizenjo, Prof Ghafoor Ahmed, Khan Abdul Qayuum Khan, Mumtaz Daultana, Sardar Shaukat Hayat and others.
Read more ‘Constitution monument’ approved
The resolution calls upon all institutions and citizens of Pakistan to uphold the Constitution of Pakistan of 1973 and to honour the spirit and values of its framers, who sought to create a just, egalitarian, and democratic society based on the principles of Islam and democracy.
It declared all the members of the Constitution Committee of 1973 and the fifth National Assembly as the national heroes of Pakistan.
The resolution declared that all those who abrogated, subverted, and suspended the Constitution of the Islamic Republic of Pakistan and/or upheld or otherwise lent legitimacy to it would always find themselves mentioned in the national hall of embarrassment.
",https://tribune.com.pk/story/2411333/na-observes-golden-jubilee-of-1973-constitution,national,https://i.tribune.com.pk/media/images/national-assembly1681137991-0/national-assembly1681137991-0.jpg
9,ECP seeks powers to announce polls date,Commission seeks amendments to Elections Act,"The Election Commission of Pakistan (ECP) has proposed amending sections 57 and 58 of the Elections Act, 2017 to empower it to change the date and schedule of the polls.
Chief Election Commissioner (CEC) Sikandar Sultan Raja had written letters to National Assembly Speaker Raja Pervez Ashraf and Senate Chairman Sadiq Sanjrani whereas ECP Secretary Omar Hamid penned letter to Prime Minister’s Principal Secretary Tauqir Shah to get back the powers it held before changes were made in 1985.
A letter was also sent to Parliamentary Affairs Secretary Shakeel Malik. According to the proposed amendment in Section 57, the ECP will announce the date for the elections whereas as per the recommended change in Section 58, the polls supervisory body would be authorised to modify the schedule issued for elections.
It will also empower the election supervisor to change the date of the polls in view of the prevailing situation.
If the amendments to sections 57 and 58 are made and a bill in this regard is passed, the schedule given by the Supreme Court for Punjab polls can also be changed.
The apex court has set May 14 as election date for polls in Punjab.
Read ECP proposes tweaks in polls law to remove ‘ambiguity'
The CEC has requested the NA speaker and Senate chairman to get amendments in Elections Act, 2017 bill passed from the parliament, also recommending that the ECP would announce the date for polls.
The letter stated that the authority to announce the election date under the law lied with the ECP, but later in 1985, during the Zia martial law period, the polls supervisory body was deprived of the power.
It was further stated that in Daska and other “important cases”, the ECP was deprived of its authority.
Daska NA-75 by-poll, held in February 2021 was marred with allegations of ballot tampering, abduction of officers on duty and excessive police and administration influence.
The by-polls gained significant right from the attempt to gerrymander the election results to the vanishing of the ECP staff and from legal fight to re-polling under strict supervision.
The ECP had suspended the flawed verdict on February 19, and ordered re-election in the constituency. Notwithstanding litigations, the apex court too endorsed the ECP stance, and a subsequent ballot in April returned PML-N’s Syeda Nosheen Iftikhar in a cut-throat competition against PTI’s Ali Asjad Malhi.
The letter stated that inquiry against corrupt officers was dropped, which had weakened the writ of the ECP, adding that the bureaucracy was given a go-ahead for corruption.
The election supervisor stated that by proposing amendments in sections 57 and 58 of the Election Act, 2017 it was now seeking back its “original powers” as mentioned in the 1976 law, and ensure fair and transparent polls in the country.
",https://tribune.com.pk/story/2411331/ecp-seeks-powers-to-announce-polls-date,national,https://i.tribune.com.pk/media/images/67734-ecpcovjpg-1528276512/67734-ecpcovjpg-1528276512.jpg
